adult,backdrop_path,genre_ids,id,original_language,original_title,overview,popularity,poster_path,release_date,title,video,vote_average,vote_count
False,/9LSsSPbP715XT9B7acIZzantPyX.jpg,[18],73,en,American History X,"Derek Vineyard is paroled after serving 3 years in prison for killing two African-American men. Through his brother, Danny Vineyard's narration, we learn that before going to prison, Derek was a skinhead and the leader of a violent white supremacist gang that committed acts of racial crime throughout L.A. and his actions greatly influenced Danny. Reformed and fresh out of prison, Derek severs contact with the gang and becomes determined to keep Danny from going down the same violent path as he did.",8.3511,/euypWkaYFOLW3e5rLIcTAjWnhhT.jpg,1998-07-01,American History X,False,8.337,11874
False,/5En0fmDagt3Pk8d7P3uTwfeQceg.jpg,"[18, 36]",490132,en,Green Book,"Tony Lip, a bouncer in 1962, is hired to drive pianist Don Shirley on a tour through the Deep South in the days when African Americans, forced to find alternate accommodations and services due to segregation laws below the Mason-Dixon Line, relied on a guide called The Negro Motorist Green Book.",12.4251,/7BsvSuDQuoqhWmU2fL7W2GOcZHU.jpg,2018-11-16,Green Book,False,8.232,12016
False,/k2ZdjMXmqnw4RJeh8cwxCvcznJZ.jpg,[18],50014,en,The Help,"Aibileen Clark is a middle-aged African-American maid who has spent her life raising white children and has recently lost her only son; Minny Jackson is an African-American maid who has often offended her employers despite her family's struggles with money and her desperate need for jobs; and Eugenia ""Skeeter"" Phelan is a young white woman who has recently moved back home after graduating college to find out her childhood maid has mysteriously disappeared. These three stories intertwine to explain how life in Jackson, Mississippi revolves around ""the help""; yet they are always kept at a certain distance because of racial lines.",11.0661,/3kmfoWWEc9Vtyuaf9v5VipRgdjx.jpg,2011-08-09,The Help,False,8.207,8554
False,/rfkIeCaIHhN3K5wjJJqKmfUjYp8.jpg,"[18, 36]",381284,en,Hidden Figures,"The untold story of Katherine G. Johnson, Dorothy Vaughan and Mary Jackson – brilliant African-American women working at NASA and serving as the brains behind one of the greatest operations in history – the launch of astronaut John Glenn into orbit. The visionary trio crossed all gender and race lines to inspire generations to dream big.",10.617,/9lfz2W2uGjyow3am00rsPJ8iOyq.jpg,2016-12-10,Hidden Figures,False,8.055,9958
False,/2reDfi3bl3givTawULOVvjEF1rR.jpg,"[10752, 18, 10749]",426618,en,Where Hands Touch,"Germany, 1944. Leyna, the 15-year old daughter of a white German mother and a black African father, meets Lutz, a compassionate member of the Hitler Youth whose father is a prominent Nazi soldier, and they form an unlikely connection in this quickly changing world.",1.6266,/omKzydOrom9kpdfQUE0G9Y9sPl0.jpg,2018-09-14,Where Hands Touch,False,7.913,520
False,/rhMpAPvoy1beXd8gA6CvYoCSztj.jpg,"[18, 36]",873,en,The Color Purple,"An epic tale spanning forty years in the life of Celie, an African-American woman living in the South who survives incredible abuse and bigotry. After Celie's abusive father marries her off to the equally debasing 'Mister' Albert Johnson, things go from bad to worse, leaving Celie to find companionship anywhere she can. She perseveres, holding on to her dream of one day being reunited with her sister in Africa.",3.8678,/6bvxkcTAXyqxGRwo38mxw92D6Xr.jpg,1985-12-18,The Color Purple,False,7.8,1842
False,/v4YV4ne1nwNni35iz4WmpZRZpCD.jpg,"[28, 18, 36]",724495,en,The Woman King,"The story of the Agojie, the all-female unit of warriors who protected the African Kingdom of Dahomey in the 1800s with skills and a fierceness unlike anything the world has ever seen, and General Nanisca as she trains the next generation of recruits and readies them for battle against an enemy determined to destroy their way of life.",7.8985,/438QXt1E3WJWb3PqNniK0tAE5c1.jpg,2022-09-16,The Woman King,False,7.67,2164
False,/xY5sgU09cOsvEAgJZaYo2aOZEFi.jpg,"[80, 18, 9648, 53]",10633,en,In the Heat of the Night,"African-American Philadelphia police detective Virgil Tibbs is arrested on suspicion of murder by Bill Gillespie, the racist police chief of tiny Sparta, Mississippi. After Tibbs proves not only his own innocence but that of another man, he joins forces with Gillespie to track down the real killer. Their investigation takes them through every social level of the town, with Tibbs making enemies as well as unlikely friends as he hunts for the truth.",3.7302,/fvqHTabYej3LwzKRRZCm6jV3g0O.jpg,1967-08-02,In the Heat of the Night,False,7.644,1134
